{
  "can_claim_device_pass": false,
  "can_close_current_base_aggregate": false,
  "can_close_ios_device_acceptance": false,
  "checks": {
    "broader_phase5_gates": {
      "advanced_adapters": {
        "blocking": false,
        "evidence": [
          "#253"
        ],
        "expected": "iOS app/product adapters for multi-client/display, audio, clipboard, files, HDR/color, actions, wake, and managed policy",
        "passed": false
      },
      "hdr_output": {
        "blocking": false,
        "evidence": [
          "#196"
        ],
        "expected": "dedicated ios-hdr-edr-gate pass for HDR/EDR output on iOS hardware, not SDR fallback only",
        "passed": false
      },
      "host_advanced_adapters": {
        "blocking": false,
        "evidence": [
          "#253"
        ],
        "expected": "MacHost advanced adapters for multi-client/display streams, audio capture, clipboard/file handlers, HDR/color retry, host actions, wake helper, and managed policy",
        "passed": false
      },
      "trusted_lan_secure_records": {
        "blocking": false,
        "evidence": [
          "#208"
        ],
        "expected": "secure-record trusted-LAN evidence; explicit plaintext legacy fallback is not enough",
        "passed": false
      }
    },
    "devices": {
      "ipad_install": {
        "blocking": true,
        "evidence": [],
        "expected": "ipad signed install/launch evidence retained",
        "passed": false
      },
      "ipad_physical_device": {
        "blocking": true,
        "evidence": [
          "missing"
        ],
        "expected": "ipad evidence comes from physical iOS hardware",
        "passed": false
      },
      "iphone_install": {
        "blocking": true,
        "evidence": [],
        "expected": "iphone signed install/launch evidence retained",
        "passed": false
      },
      "iphone_physical_device": {
        "blocking": true,
        "evidence": [
          "missing"
        ],
        "expected": "iphone evidence comes from physical iOS hardware",
        "passed": false
      }
    },
    "environment": {
      "ios_sdk_available": {
        "blocking": true,
        "evidence": [
          "xcode-select: error: tool 'xcodebuild' requires Xcode, but active developer directory '/Library/Developer/CommandLineTools' is a command line tools instance"
        ],
        "expected": "xcodebuild -showsdks lists an iPhoneOS SDK",
        "passed": false
      },
      "xcodebuild_available": {
        "blocking": true,
        "evidence": [
          "xcode-select: error: tool 'xcodebuild' requires Xcode, but active developer directory '/Library/Developer/CommandLineTools' is a command line tools instance"
        ],
        "expected": "full Xcode xcodebuild is available",
        "passed": false
      }
    },
    "evidence_substitution": {
      "no_android_evidence_for_ios": {
        "blocking": true,
        "evidence": [],
        "expected": "Android evidence is not used for iOS gates",
        "passed": true
      },
      "no_simulator_or_android_device_substitution": {
        "blocking": true,
        "evidence": [],
        "expected": "device records are missing or physical iOS hardware only",
        "passed": true
      }
    },
    "formal_device_gates": {
      "audio_playback": {
        "blocking": true,
        "evidence": [
          "#209"
        ],
        "expected": "PCM S16LE AVAudioEngine playback with audible confirmation",
        "passed": false
      },
      "device_install": {
        "blocking": true,
        "evidence": [
          "#290"
        ],
        "expected": "signed app installed and launched on both iPhone and iPad-class hardware",
        "passed": false
      },
      "input": {
        "blocking": true,
        "evidence": [
          "#257"
        ],
        "expected": "touch, drag, keyboard modifiers, and pointer/hover behavior with host acknowledgement",
        "passed": false
      },
      "protocol_session": {
        "blocking": true,
        "evidence": [
          "#290"
        ],
        "expected": "real iOS app/device trusted-LAN session envelopes against the host",
        "passed": false
      },
      "reconnect": {
        "blocking": true,
        "evidence": [
          "#238"
        ],
        "expected": "network interruption and heartbeat reconnect with stale-epoch rejection",
        "passed": false
      },
      "signing": {
        "blocking": true,
        "evidence": [
          "#290"
        ],
        "expected": "signed archive, unique bundle ID, team, certificate, and provisioning profile",
        "passed": false
      },
      "videotoolbox_h264": {
        "blocking": true,
        "evidence": [
          "#251"
        ],
        "expected": "hardware H.264 VideoToolbox decode on iOS hardware",
        "passed": false
      },
      "videotoolbox_hevc": {
        "blocking": true,
        "evidence": [
          "#251"
        ],
        "expected": "hardware HEVC VideoToolbox decode on iOS hardware",
        "passed": false
      }
    },
    "metadata": {
      "aggregate_owner": {
        "blocking": false,
        "evidence": [
          "current-base-ios-acceptance"
        ],
        "expected": "current-base-ios-acceptance",
        "passed": true
      },
      "aggregate_owner_pr": {
        "blocking": false,
        "evidence": [
          "#290"
        ],
        "expected": "current-base aggregate owner #290",
        "passed": true
      },
      "device_acceptance_owner": {
        "blocking": false,
        "evidence": [
          "#290"
        ],
        "expected": "device acceptance evidence owner #290",
        "passed": true
      },
      "kind": {
        "blocking": false,
        "evidence": [],
        "expected": "ios_current_base_readiness_manifest",
        "passed": true
      },
      "schema_version": {
        "blocking": false,
        "evidence": [],
        "expected": "vibescreen.evidence/v1",
        "passed": true
      },
      "scope_prs": {
        "blocking": false,
        "evidence": [
          "#182",
          "#196",
          "#207",
          "#208",
          "#209",
          "#238",
          "#251",
          "#253",
          "#257",
          "#279",
          "#282"
        ],
        "expected": "all current-base iOS PRs are in scope",
        "passed": true
      },
      "source_docs": {
        "blocking": false,
        "evidence": [
          "docs/changes/2026-08-04-phase-5-ios-advanced/PRD.md",
          "docs/changes/2026-08-04-phase-5-ios-advanced/TECH.md",
          "docs/changes/2026-08-04-phase-5-ios-advanced/TEST.md",
          "docs/runbook/hdr-color-acceptance.md",
          "docs/runbook/ios-device-acceptance.md"
        ],
        "expected": "Phase 5 PRD/TECH/TEST and iOS device runbook are referenced and present",
        "passed": true
      }
    },
    "native_input": {
      "dedicated_native_input_artifacts": {
        "blocking": true,
        "evidence": [],
        "expected": "ios-native-input-gate.json retains sanitized iOS/Host native-input artifacts",
        "passed": false
      },
      "dedicated_native_input_current_base": {
        "blocking": true,
        "evidence": [
          "exclusively reserve the iPhone and iPad used for this run",
          "record iPhone and iPad model, OS/build, and device family",
          "run on real iPhone and iPad hardware, not Simulator",
          "record native-input behavior from a signed iPhone app run",
          "record native-input behavior from a signed iPad app run",
          "record the iOS app source revision and dirty-tree state",
          "install a signed app build on the recorded iOS device",
          "record the Local Network permission result",
          "record the baseline MacHost listener and build identity",
          "capture SSWA/SSWR, upgrade, Hello, SessionAccepted, and display start",
          "negotiate touch, keyboard, pointer, and USB HID modifier-byte capabilities as applicable",
          "record the selected display ID and stream ID used by input events",
          "observe a real touch tap forwarded from the iOS app",
          "observe a real touch drag forwarded from the iOS app",
          "attach and identify a physical iOS hardware keyboard",
          "prove key-down and key-up forwarding for the same USB HID usage",
          "prove a modifier or shortcut uses the negotiated USB HID modifier byte",
          "prove modifiers clear after release and do not leak into a later plain key",
          "attach and identify a real iOS hover/pointer accessory",
          "observe hover or pointer movement over the selected stream",
          "retain Host-side acknowledgements or logs for every input family",
          "retain sanitized iOS app/device logs for the input workflow",
          "retain sanitized Host logs for the input workflow",
          "ios native-input gate is unreadable"
        ],
        "expected": "ios-native-input-gate.json current_base matches clean repository HEAD",
        "passed": false
      },
      "dedicated_native_input_gate": {
        "blocking": true,
        "evidence": [
          "docs/changes/2026-08-04-phase-5-ios-advanced/evidence/2026-08-30-ios-signing-current-base-blocked/ios-native-input-gate.json"
        ],
        "expected": "ios-native-input-gate.json passes and is bound into current-base readiness",
        "passed": false
      },
      "dedicated_native_input_owner": {
        "blocking": true,
        "evidence": [
          "exclusively reserve the iPhone and iPad used for this run",
          "record iPhone and iPad model, OS/build, and device family",
          "run on real iPhone and iPad hardware, not Simulator",
          "record native-input behavior from a signed iPhone app run",
          "record native-input behavior from a signed iPad app run",
          "record the iOS app source revision and dirty-tree state",